{
  "title": "Q3 Launch Readiness",
  "slides": [
    {
      "role": "opening",
      "purpose": "Set decision context",
      "key_message": "Launch readiness is high with two watch items",
      "visual_intent": "status scoreboard",
      "content_blocks": [
        {
          "heading": "Readiness",
          "bullets": ["Product: green", "Ops: yellow", "Legal: green"]
        }
      ],
      "speaker_notes": ["Frame risks and confidence."],
      "confidence": 0.84,
      "explanation": {
        "reasoning": "Mirrors objective and audience urgency.",
        "source_signals": ["objective", "constraints"]
      },
      "provenance_refs": []
    }
  ],
  "provenance_refs": [],
  "grounding_report": null
}
